word,count
growing number of microbreweries,1
number of microbreweries in,1
of microbreweries in phnom,1
microbreweries in phnom penh,1
in phnom penh and,1
phnom penh and siem,1
penh and siem reap,1
"and siem reap plays,",1
"siem reap plays, farces,",1
"reap plays, farces, spectacles,",1
"plays, farces, spectacles, gladiators,",1
"farces, spectacles, gladiators, strange",1
"spectacles, gladiators, strange beasts,",1
"gladiators, strange beasts, medals,",1
"strange beasts, medals, pictures,",1
"beasts, medals, pictures, and",1
"medals, pictures, and other",1
"pictures, and other such",1
"and other such opiates,",1
"other such opiates, these",1
"such opiates, these were",1
"opiates, these were for",1
these were for ancient,1
were for ancient peoples,1
for ancient peoples the,1
ancient peoples the bait,1
peoples the bait toward,1
"the bait toward slavery,",1
"bait toward slavery, the",1
"toward slavery, the price",1
"slavery, the price of",1
the price of their,1
"price of their liberty,",1
"of their liberty, the",1
"their liberty, the instruments",1
"liberty, the instruments of",1
the instruments of tyranny,1
instruments of tyranny farmers,1
of tyranny farmers harvesting,1
tyranny farmers harvesting rice,1
farmers harvesting rice in,1
harvesting rice in battambang,1
rice in battambang province,1
in battambang province cambodia,1
battambang province cambodia ranked,1
province cambodia ranked among,1
cambodia ranked among the,1
ranked among the worst,1
among the worst places,1
the worst places in,1
worst places in the,1
places in the world,1
the world for organised,1
world for organised labour,1
for organised labour in,1
organised labour in the,1
labour in the 2015,1
in the 2015 international,1
the 2015 international trade,1
2015 international trade union,1
international trade union confederation,1
trade union confederation (ituc),1
union confederation (ituc) global,1
confederation (ituc) global rights,1
"(ituc) global rights index,",1
"global rights index, landing",1
"rights index, landing in",1
"index, landing in the",1
landing in the category,1
in the category of,1
the category of countries,1
category of countries with,1
"of countries with ""no",1
"countries with ""no guarantee",1
"with ""no guarantee of",1
"""no guarantee of rights""",1
"guarantee of rights"" the",1
"of rights"" the measurement",1
"rights"" the measurement of",1
the measurement of the,1
measurement of the result,1
of the result may,1
the result may be,1
result may be objective,1
may be objective or,1
"be objective or subjective,",1
"objective or subjective, and",1
"or subjective, and corrected",1
"subjective, and corrected with",1
"and corrected with ""handicaps""",1
"corrected with ""handicaps"" or",1
"with ""handicaps"" or penalties",1
"""handicaps"" or penalties youth",1
or penalties youth sport,1
penalties youth sport in,1
youth sport in the,1
sport in the us,1
in the us is,1
the us is a,1
us is a $15,1
is a $15 billion,1
a $15 billion industry,1
$15 billion industry including,1
billion industry including equipment,1
industry including equipment up,1
including equipment up to,1
equipment up to private,1
up to private coaching,1
to private coaching closely,1
private coaching closely related,1
coaching closely related fields,1
closely related fields include,1
related fields include cultural,1
"fields include cultural history,",1
"include cultural history, gender",1
"cultural history, gender history,",1
"history, gender history, and",1
"gender history, and religious",1
"history, and religious history",1
and religious history only,1
religious history only men,1
history only men aged,1
only men aged 20,1
men aged 20 to,1
aged 20 to 60,1
20 to 60 were,1
"to 60 were counted,",1
"60 were counted, as",1
"were counted, as its",1
"counted, as its purpose",1
as its purpose was,1
its purpose was for,1
purpose was for the,1
was for the collection,1
for the collection of,1
the collection of taxes,1
collection of taxes the,1
of taxes the districts,1
taxes the districts and,1
the districts and municipalities,1
districts and municipalities in,1
and municipalities in turn,1
municipalities in turn are,1
in turn are further,1
turn are further divided,1
are further divided into,1
further divided into communes,1
divided into communes (khum),1
into communes (khum) and,1
communes (khum) and quarters,1
(khum) and quarters (sangkat),1
and quarters (sangkat) 500,1
"quarters (sangkat) 500 bc,",1
"(sangkat) 500 bc, louvre",1
"500 bc, louvre museum[j]",1
"bc, louvre museum[j] conversely,",1
"louvre museum[j] conversely, when",1
"museum[j] conversely, when large",1
"conversely, when large datasets",1
when large datasets are,1
"large datasets are available,",1
"datasets are available, quantitative",1
"are available, quantitative approaches",1
"available, quantitative approaches can",1
quantitative approaches can be,1
approaches can be used[needs,1
can be used[needs update],1
be used[needs update] after,1
used[needs update] after the,1
update] after the 2013,1
after the 2013 cambodian,1
the 2013 cambodian general,1
"2013 cambodian general election,",1
"cambodian general election, allegations",1
"general election, allegations of",1
"election, allegations of voter",1
allegations of voter fraud,1
of voter fraud from,1
voter fraud from opposition,1
fraud from opposition party,1
from opposition party cambodia,1
opposition party cambodia national,1
party cambodia national rescue,1
national rescue party led,1
rescue party led to,1
party led to widespread,1
led to widespread anti-government,1
to widespread anti-government protests,1
widespread anti-government protests that,1
anti-government protests that continued,1
protests that continued into,1
that continued into the,1
continued into the following,1
into the following year,1
the following year for,1
following year for a,1
year for a general,1
"general history of earth,",1
"history of earth, see",1
"of earth, see history",1
"earth, see history of",1
see history of earth,1
history of earth he,1
of earth he was,1
earth he was enthroned,1
he was enthroned in,1
was enthroned in phnom,1
enthroned in phnom penh,1
phnom penh on 29,1
penh on 29 october,1
on 29 october 2004,1
29 october 2004 most,1
october 2004 most rural,1
2004 most rural households,1
most rural households depend,1
rural households depend on,1
households depend on agriculture,1
depend on agriculture and,1
on agriculture and its,1
agriculture and its related,1
and its related sub-sectors,1
its related sub-sectors the,1
related sub-sectors the well-known,1
sub-sectors the well-known sentiment,1
the well-known sentiment by,1
well-known sentiment by sports,1
sentiment by sports journalist,1
by sports journalist grantland,1
"sports journalist grantland rice,",1
"journalist grantland rice, that",1
"grantland rice, that it",1
"rice, that it is",1
"that it is ""not",1
"it is ""not that",1
"is ""not that you",1
"""not that you won",1
that you won or,1
you won or lost,1
won or lost but,1
or lost but how,1
lost but how you,1
but how you played,1
how you played the,1
"you played the game"",",1
"played the game"", and",1
"the game"", and the",1
"game"", and the modern",1
and the modern olympic,1
the modern olympic creed,1
modern olympic creed expressed,1
olympic creed expressed by,1
creed expressed by its,1
expressed by its founder,1
by its founder pierre,1
its founder pierre de,1
founder pierre de coubertin:,1
"pierre de coubertin: ""the",1
"de coubertin: ""the most",1
"coubertin: ""the most important",1
"""the most important thing",1
most important thing in,1
important thing in response,1
thing in response to,1
in response to the,1
response to the north,1
to the north vietnamese,1
"the north vietnamese invasion,",1
"north vietnamese invasion, us",1
"vietnamese invasion, us president",1
"invasion, us president richard",1
us president richard nixon,1
president richard nixon announced,1
richard nixon announced that,1
nixon announced that us,1
announced that us and,1
that us and south,1
us and south vietnamese,1
and south vietnamese ground,1
south vietnamese ground forces,1
vietnamese ground forces had,1
ground forces had entered,1
forces had entered cambodia,1
had entered cambodia in,1
entered cambodia in a,1
cambodia in a campaign,1
in a campaign aimed,1
a campaign aimed at,1
campaign aimed at destroying,1
aimed at destroying nva,1
at destroying nva base,1
destroying nva base areas,1
nva base areas in,1
base areas in cambodia,1
areas in cambodia (see,1
in cambodia (see cambodian,1
cambodia (see cambodian incursion),1
(see cambodian incursion) the,1
cambodian incursion) the united,1
incursion) the united nations,1
the united nations designates,1
united nations designates cambodia,1
nations designates cambodia as,1
designates cambodia as a,1
cambodia as a least,1
as a least developed,1
least developed country starting,1
developed country starting in,1
country starting in the,1
starting in the 15th,1
"in the 15th century,",1
"the 15th century, european",1
"15th century, european exploration",1
"century, european exploration and",1
european exploration and colonization,1
exploration and colonization interconnected,1
and colonization interconnected the,1
"colonization interconnected the globe,",1
"interconnected the globe, while",1
"the globe, while cultural,",1
"globe, while cultural, intellectual,",1
"while cultural, intellectual, and",1
"cultural, intellectual, and scientific",1
"intellectual, and scientific developments",1
and scientific developments transformed,1
scientific developments transformed western,1
developments transformed western societies,1
transformed western societies cambodia,1
western societies cambodia has,1
societies cambodia has a,1
cambodia has a temperature,1
has a temperature range,1
a temperature range from,1
temperature range from 21,1
range from 21 to,1
from 21 to 35,1
21 to 35 °c,1
to 35 °c (70,1
35 °c (70 to,1
°c (70 to 95,1
(70 to 95 °f),1
to 95 °f) and,1
95 °f) and experiences,1
°f) and experiences tropical,1
and experiences tropical monsoons[g],1
experiences tropical monsoons[g] once,1
tropical monsoons[g] once the,1
monsoons[g] once the information,1
once the information content,1
the information content of,1
information content of a,1
content of a source,1
of a source is,1
"a source is understood,",1
"source is understood, internal",1
"is understood, internal criticism",1
"understood, internal criticism is",1
internal criticism is specifically,1
criticism is specifically interested,1
is specifically interested in,1
specifically interested in determining,1
interested in determining accuracy,1
"in determining accuracy herodotus,",1
"determining accuracy herodotus, a",1
"accuracy herodotus, a 5th-century",1
"herodotus, a 5th-century bce",1
a 5th-century bce greek,1
"5th-century bce greek historian,",1
"bce greek historian, is",1
"greek historian, is often",1
"historian, is often considered",1
is often considered the,1
"often considered the ""father",1
"considered the ""father of",1
"the ""father of history"",",1
"""father of history"", as",1
"of history"", as one",1
"history"", as one of",1
one of the first,1
of the first historians,1
the first historians in,1
first historians in the,1
historians in the western,1
"in the western tradition,",1
"the western tradition, though",1
"western tradition, though he",1
"tradition, though he has",1
though he has been,1
he has been criticized,1
has been criticized as,1
been criticized as the,1
"criticized as the ""father",1
"as the ""father of",1
"the ""father of lies""",1
"""father of lies"" history",1
"of lies"" history can",1
"lies"" history can also",1
history can also foster,1
can also foster social,1
also foster social cohesion,1
foster social cohesion by,1
social cohesion by providing,1
cohesion by providing people,1
by providing people with,1
providing people with a,1
people with a collective,1
with a collective identity,1
a collective identity through,1
collective identity through a,1
identity through a shared,1
"through a shared past,",1
"a shared past, helping",1
"shared past, helping to",1
"past, helping to preserve",1
helping to preserve and,1
to preserve and cultivate,1
preserve and cultivate cultural,1
and cultivate cultural heritage,1
cultivate cultural heritage and,1
cultural heritage and values,1
heritage and values across,1
and values across generations,1
values across generations french,1
across generations french colonisation,1
generations french colonisation coronation,1
french colonisation coronation of,1
colonisation coronation of norodom,1
coronation of norodom sihanouk,1
of norodom sihanouk in,1
norodom sihanouk in 1941,1
sihanouk in 1941 in,1
"in 1941 in 1863,",1
"1941 in 1863, king",1
"in 1863, king norodom",1
"1863, king norodom signed",1
king norodom signed a,1
norodom signed a treaty,1
signed a treaty of,1
a treaty of protection,1
treaty of protection with,1
of protection with france,1
protection with france senior,1
with france senior olympics,1
france senior olympics (senior,1
senior olympics (senior games),1
olympics (senior games) usatf,1
(senior games) usatf masters,1
games) usatf masters outdoor,1
usatf masters outdoor championships,1
masters outdoor championships began,1
outdoor championships began 1968,1
championships began 1968 usatf,1
began 1968 usatf masters,1
1968 usatf masters indoor,1
usatf masters indoor championships,1
masters indoor championships began,1
indoor championships began 1975,1
championships began 1975 world,1
began 1975 world masters,1
1975 world masters athletics,1
world masters athletics championships,1
masters athletics championships began,1
athletics championships began 1975,1
championships began 1975 spectator,1
began 1975 spectator involvement,1
1975 spectator involvement main,1
spectator involvement main article:,1
involvement main article: spectator,1
main article: spectator sport,1
article: spectator sport spectators,1
spectator sport spectators at,1
sport spectators at the,1
spectators at the 1906,1
at the 1906 unofficial,1
the 1906 unofficial olympic,1
1906 unofficial olympic games,1
unofficial olympic games the,1
olympic games the competition,1
games the competition element,1
the competition element of,1
"competition element of sport,",1
"element of sport, along",1
"of sport, along with",1
"sport, along with the",1
along with the aesthetic,1
with the aesthetic appeal,1
the aesthetic appeal of,1
aesthetic appeal of some,1
"appeal of some sports,",1
"of some sports, result",1
"some sports, result in",1
"sports, result in the",1
result in the popularity,1
in the popularity of,1
the popularity of people,1
popularity of people attending,1
of people attending to,1
people attending to watch,1
attending to watch sport,1
to watch sport being,1
watch sport being played,1
"sport being played ""historical",1
"being played ""historical archaeology""",1
"played ""historical archaeology"" is",1
"""historical archaeology"" is a",1
"archaeology"" is a specific",1
is a specific branch,1
a specific branch of,1
specific branch of archeology,1
branch of archeology which,1
of archeology which often,1
archeology which often contrasts,1
which often contrasts its,1
often contrasts its conclusions,1
contrasts its conclusions against,1
its conclusions against those,1
conclusions against those of,1
against those of contemporary,1
those of contemporary textual,1
of contemporary textual sources,1
contemporary textual sources this,1
textual sources this view,1
sources this view emphasizes,1
this view emphasizes that,1
view emphasizes that the,1
emphasizes that the disinterested,1
that the disinterested pursuit,1
the disinterested pursuit of,1
disinterested pursuit of truth,1
pursuit of truth is,1
of truth is an,1
truth is an end,1
is an end in,1
"end in itself, while",1
"in itself, while external",1
"itself, while external purposes,",1
"while external purposes, associated",1
"external purposes, associated with",1
"purposes, associated with ideology",1
associated with ideology or,1
"with ideology or politics,",1
"ideology or politics, threaten",1
"or politics, threaten to",1
"politics, threaten to undermine",1
threaten to undermine the,1
to undermine the accuracy,1
undermine the accuracy of,1
the accuracy of historical,1
accuracy of historical research,1
of historical research by,1
historical research by distorting,1
research by distorting the,1
by distorting the past,1
distorting the past the,1
the past the election,1
past the election was,1
the election was won,1
election was won by,1
was won by funcinpec,1
won by funcinpec led,1
by funcinpec led by,1
funcinpec led by sihanouk's,1
led by sihanouk's son,1
by sihanouk's son ranariddh,1
sihanouk's son ranariddh in,1
son ranariddh in a,1
ranariddh in a hung,1
in a hung parliament,1
a hung parliament european,1
hung parliament european influence,1
parliament european influence grew,1
european influence grew over,1
influence grew over the,1
grew over the following,1
"over the following centuries,",1
"the following centuries, culminating",1
"following centuries, culminating in",1
"centuries, culminating in the",1
culminating in the 19th,1
in the 19th and,1
the 19th and early,1
19th and early 20th,2
and early 20th centuries,2
early 20th centuries when,1
20th centuries when many,1
centuries when many parts,1
when many parts of,1
many parts of asia,1
parts of asia came,1
of asia came under,1
asia came under direct,1
came under direct colonial,1
under direct colonial control,1
direct colonial control until,1
colonial control until the,1
control until the end,1
until the end of,1
the end of world,1
end of world war,1
of world war ii,1
world war ii of,1
war ii of the,1
ii of the naturally,1
of the naturally regenerating,1
the naturally regenerating forest,1
naturally regenerating forest 4%,1
regenerating forest 4% was,1
forest 4% was reported,1
4% was reported to,1
reported to be primary,1
to be primary forest,1
be primary forest (consisting,1
primary forest (consisting of,1
forest (consisting of native,1
(consisting of native tree,1
of native tree species,1
native tree species with,1
tree species with no,1
species with no clearly,1
with no clearly visible,1
no clearly visible indications,1
clearly visible indications of,1
visible indications of human,1
indications of human activity),1
of human activity) siem,1
human activity) siem reap-angkor,1
activity) siem reap-angkor international,1
siem reap-angkor international airport,1
reap-angkor international airport is,1
airport is the second,1
"is the second busiest,",1
"the second busiest, and",1
"second busiest, and serves",1
"busiest, and serves the",1
and serves the most,1
serves the most international,1
the most international flights,1
most international flights in,1
international flights in and,1
flights in and out,1
in and out of,1
and out of cambodia,1
"out of cambodia 1265),",1
"of cambodia 1265), narrative",1
"cambodia 1265), narrative of",1
"1265), narrative of real",1
narrative of real or,1
of real or imaginary,1
"real or imaginary events,",1
"or imaginary events, story",1
"imaginary events, story (c1383):",1
"events, story (c1383): ""i",1
"story (c1383): ""i finde",1
"(c1383): ""i finde in",1
"""i finde in a",1
finde in a bok,1
in a bok compiled,1
a bok compiled |,1
bok compiled | to,1
compiled | to this,1
| to this matiere,1
to this matiere an,1
this matiere an old,1
"matiere an old histoire,",1
"an old histoire, |",1
"old histoire, | the",1
"histoire, | the which",1
| the which comth,1
the which comth nou,1
which comth nou to,1
comth nou to mi,1
"nou to mi memoire""",1
"to mi memoire"" it",1
"mi memoire"" it has",1
"memoire"" it has a",1
it has a 443-kilometre,1
has a 443-kilometre (275-mile),1
a 443-kilometre (275-mile) coastline,1
443-kilometre (275-mile) coastline along,1
(275-mile) coastline along the,1
the gulf of thailand39%,1
gulf of thailand39% 2004,1
"of thailand39% 2004 12,800,000",1
"thailand39% 2004 12,800,000 +1",1
"2004 12,800,000 +1 in",1
"12,800,000 +1 in the",1
+1 in the 20th,1
in the 20th century,1
the 20th century the,1
20th century the annales,1
century the annales school,1
the annales school revolutionized,1
annales school revolutionized the,1
school revolutionized the study,1
revolutionized the study of,1
"the study of history,",1
"study of history, by",1
"of history, by using",1
"history, by using such",1
by using such outside,1
using such outside disciplines,1
such outside disciplines as,1
"outside disciplines as economics,",1
"disciplines as economics, sociology,",1
"as economics, sociology, and",1
"economics, sociology, and geography",1
"sociology, and geography in",1
and geography in the,1
geography in the study,1
in the study of,1
the study of global,1
study of global history,1
of global history show,1
"global history show jumping,",1
"history show jumping, an",1
"show jumping, an equestrian",1
"jumping, an equestrian sport",1
an equestrian sport the,1
equestrian sport the precise,1
sport the precise definition,1
the precise definition of,1
precise definition of what,1
definition of what differentiates,1
of what differentiates a,1
what differentiates a sport,1
differentiates a sport from,1
a sport from other,1
sport from other leisure,1
from other leisure activities,1
other leisure activities varies,1
leisure activities varies between,1
activities varies between sources,1
varies between sources professionalism,1
between sources professionalism became,1
"sources professionalism became prevalent,",1
"professionalism became prevalent, further",1
"became prevalent, further adding",1
"prevalent, further adding to",1
further adding to the,1
adding to the increase,1
to the increase in,1
the increase in sport's,1
"increase in sport's popularity,",1
"in sport's popularity, as",1
"sport's popularity, as sports",1
"popularity, as sports fans",1
as sports fans followed,1
sports fans followed the,1
fans followed the exploits,1
followed the exploits of,1
the exploits of professional,1
exploits of professional athletes,1
of professional athletes –,1
professional athletes – all,1
athletes – all while,1
– all while enjoying,1
all while enjoying the,1
while enjoying the exercise,1
enjoying the exercise and,1
the exercise and competition,1
exercise and competition associated,1
and competition associated with,1
competition associated with amateur,1
associated with amateur participation,1
with amateur participation in,1
amateur participation in sports,1
participation in sports on,1
in sports on 28,1
sports on 28 march,1
on 28 march a,1
28 march a press,1
march a press conference,1
a press conference was,1
press conference was held,1
conference was held and,1
was held and sihanouk,1
held and sihanouk appealed,1
and sihanouk appealed to,1
sihanouk appealed to the,1
appealed to the international,1
to the international media:,1
"the international media: ""i",1
"international media: ""i appeal",1
"media: ""i appeal to",1
"""i appeal to you",1
appeal to you to,1
to you to publicise,1
you to publicise abroad,1
to publicise abroad this,1
publicise abroad this very,1
abroad this very clear,1
this very clear stand,1
very clear stand of,1
clear stand of cambodia—that,1
"stand of cambodia—that is,",1
"of cambodia—that is, i",1
"cambodia—that is, i will,",1
"is, i will, in",1
"i will, in any",1
"will, in any case,",1
"in any case, oppose",1
"any case, oppose all",1
"case, oppose all bombings",1
oppose all bombings on,1
all bombings on cambodian,1
bombings on cambodian territory,1
on cambodian territory under,1
cambodian territory under whatever,1
territory under whatever pretext,1
under whatever pretext volleyball,1
whatever pretext volleyball is,1
pretext volleyball is by,1
volleyball is by far,1
is by far the,1
by far the most,1
far the most popular,1
the most popular sport,1
most popular sport in,1
popular sport in the,1
sport in the country,1
in the country proponents,1
the country proponents said,1
country proponents said it,1
proponents said it was,1
said it was a,1
it was a reaction,1
was a reaction against,1
a reaction against the,1
reaction against the memorization,1
against the memorization of,1
the memorization of names,1
memorization of names and,1
of names and dates,1
names and dates that,1
and dates that characterized,1
dates that characterized teaching,1
that characterized teaching and,1
characterized teaching and left,1
teaching and left the,1
and left the students,1
left the students bored,1
the students bored specializations,1
students bored specializations of,1
bored specializations of different,1
specializations of different types,1
of different types can,1
different types can usually,1
types can usually be,1
can usually be combined,1
usually be combined it,1
be combined it was,1
combined it was fully,1
it was fully beholden,1
was fully beholden to,1
fully beholden to the,1
beholden to the occupying,1
to the occupying vietnamese,1
the occupying vietnamese army,1
occupying vietnamese army and,1
vietnamese army and under,1
army and under the,1
and under the direction,1
under the direction of,1
the direction of the,1
direction of the vietnamese,1
of the vietnamese ambassador,1
the vietnamese ambassador to,1
vietnamese ambassador to phnom,1
ambassador to phnom penh,1
to phnom penh judgement,1
phnom penh judgement see,1
penh judgement see also:,1
judgement see also: ash,1
see also: ash heap,1
also: ash heap of,1
ash heap of history,1
heap of history since,1
of history since the,1
history since the 20th,1
"since the 20th century,",1
"the 20th century, western",1
"20th century, western historians",1
"century, western historians have",1
western historians have disavowed,1
historians have disavowed the,1
have disavowed the aspiration,1
disavowed the aspiration to,1
the aspiration to provide,1
aspiration to provide the,1
"to provide the ""judgement",1
"provide the ""judgement of",1
"the ""judgement of history""",1
"""judgement of history"" older",1
"of history"" older participation",1
"history"" older participation see",1
older participation see also:,1
participation see also: masters,1
"see also: masters athletics,",1
