word,count
the,1
the toasted,1
the toasted baguette,1
the toasted baguette pieces,1
toasted baguette pieces are,1
baguette pieces are dipped,1
pieces are dipped in,1
are dipped in the,1
dipped in the curry,1
in the curry and,1
the curry and eaten,1
curry and eaten disastrous,1
and eaten disastrous flooding,1
eaten disastrous flooding occurred,1
disastrous flooding occurred in,1
flooding occurred in 2001,1
occurred in 2001 and,1
in 2001 and again,1
2001 and again in,1
"and again in 2002,",1
"again in 2002, with",1
"in 2002, with some",1
"2002, with some degree",1
with some degree of,1
some degree of flooding,1
degree of flooding almost,1
of flooding almost every,1
flooding almost every year,1
almost every year for,1
"every year for him,",1
"year for him, historia",1
"for him, historia was",1
"him, historia was ""the",1
"historia was ""the knowledge",1
"was ""the knowledge of",1
"""the knowledge of objects",1
knowledge of objects determined,1
of objects determined by,1
objects determined by space,1
determined by space and,1
"by space and time"",",1
"space and time"", that",1
"and time"", that sort",1
"time"", that sort of",1
that sort of knowledge,1
sort of knowledge provided,1
of knowledge provided by,1
knowledge provided by memory,1
provided by memory (while,1
by memory (while science,1
memory (while science was,1
(while science was provided,1
science was provided by,1
"was provided by reason,",1
"provided by reason, and",1
"by reason, and poetry",1
"reason, and poetry was",1
and poetry was provided,1
poetry was provided by,1
was provided by fantasy),1
provided by fantasy) political,1
by fantasy) political history,1
fantasy) political history studies,1
political history studies the,1
history studies the organization,1
studies the organization of,1
the organization of power,1
organization of power in,1
"of power in society,",1
"power in society, examining",1
"in society, examining how",1
"society, examining how power",1
examining how power structures,1
"how power structures arise,",1
"power structures arise, develop,",1
"structures arise, develop, and",1
"arise, develop, and interact",1
"develop, and interact despite",1
and interact despite adopting,1
interact despite adopting an,1
despite adopting an 'anti-corruption,1
adopting an 'anti-corruption law',1
an 'anti-corruption law' in,1
"'anti-corruption law' in 2010,",1
"law' in 2010, corruption",1
"in 2010, corruption prevails",1
"2010, corruption prevails throughout",1
corruption prevails throughout the,1
prevails throughout the country,1
throughout the country as,1
the country as of,1
"country as of 1987,",1
"as of 1987, only",1
"of 1987, only one",1
"1987, only one passenger",1
only one passenger train,1
one passenger train per,1
passenger train per week,1
train per week operated,1
per week operated between,1
week operated between phnom,1
operated between phnom penh,1
between phnom penh and,1
phnom penh and battambang,1
penh and battambang but,1
and battambang but a,1
battambang but a us$141,1
but a us$141 million,1
"a us$141 million project,",1
"us$141 million project, funded",1
"million project, funded mostly",1
"project, funded mostly by",1
funded mostly by the,1
mostly by the asian,1
by the asian development,1
"the asian development bank,",1
"asian development bank, has",1
"development bank, has been",1
"bank, has been started",1
has been started to,1
been started to revitalise,1
started to revitalise the,1
to revitalise the languishing,1
revitalise the languishing rail,1
the languishing rail system,1
languishing rail system that,1
rail system that will,1
"system that will ""(interlink)",1
"that will ""(interlink) cambodia",1
"will ""(interlink) cambodia with",1
"""(interlink) cambodia with major",1
cambodia with major industrial,1
with major industrial and,1
major industrial and logistics,1
industrial and logistics centers,1
and logistics centers in,1
logistics centers in bangkok,1
centers in bangkok and,1
in bangkok and ho,1
bangkok and ho chi,1
and ho chi minh,1
"ho chi minh city""",1
"chi minh city"" stories",1
"minh city"" stories common",1
"city"" stories common to",1
stories common to a,1
common to a particular,1
"to a particular culture,",1
"a particular culture, but",1
"particular culture, but not",1
"culture, but not supported",1
but not supported by,1
not supported by external,1
supported by external sources,1
by external sources (such,1
external sources (such as,1
sources (such as the,1
(such as the tales,1
as the tales surrounding,1
the tales surrounding king,1
"tales surrounding king arthur),",1
"surrounding king arthur), are",1
"king arthur), are usually",1
"arthur), are usually classified",1
are usually classified as,1
usually classified as cultural,1
classified as cultural heritage,1
as cultural heritage or,1
cultural heritage or legends,1
heritage or legends native,1
or legends native sports,1
legends native sports include,1
native sports include traditional,1
sports include traditional boat,1
"include traditional boat racing,",1
"traditional boat racing, buffalo",1
"boat racing, buffalo racing,",1
"racing, buffalo racing, pradal",1
"buffalo racing, pradal serey,",1
"racing, pradal serey, khmer",1
"pradal serey, khmer traditional",1
"serey, khmer traditional wrestling",1
khmer traditional wrestling and,1
traditional wrestling and bokator,1
wrestling and bokator traditionalists,1
and bokator traditionalists protested,1
bokator traditionalists protested loudly,1
traditionalists protested loudly it,1
protested loudly it was,1
loudly it was a,1
it was a postmodern,1
was a postmodern innovation,1
a postmodern innovation that,1
postmodern innovation that threatened,1
innovation that threatened to,1
that threatened to leave,1
threatened to leave the,1
to leave the youth,1
leave the youth ignorant,1
the youth ignorant of,1
youth ignorant of french,1
ignorant of french patriotism,1
of french patriotism and,1
french patriotism and national,1
patriotism and national identity,1
and national identity whether,1
national identity whether a,1
identity whether a document,1
whether a document is,1
a document is a,1
document is a primary,1
is a primary or,1
a primary or a,1
primary or a secondary,1
or a secondary source,1
a secondary source depends,1
secondary source depends not,1
source depends not only,1
depends not only on,1
not only on the,1
only on the document,1
on the document itself,1
the document itself but,1
document itself but also,1
itself but also on,1
but also on the,1
also on the purpose,1
on the purpose for,1
the purpose for which,1
purpose for which it,1
for which it is,1
which it is used,1
it is used historians,1
is used historians debate,1
used historians debate whether,1
historians debate whether history,1
debate whether history can,1
whether history can be,1
history can be taught,1
can be taught as,1
be taught as a,1
taught as a single,1
as a single coherent,1
a single coherent narrative,1
single coherent narrative or,1
coherent narrative or a,1
narrative or a series,1
or a series of,1
a series of competing,1
series of competing narratives,1
of competing narratives this,1
competing narratives this era,1
narratives this era gave,1
this era gave rise,1
era gave rise to,1
gave rise to the,1
rise to the term,1
to the term killing,1
"the term killing fields,",1
"term killing fields, and",1
"killing fields, and the",1
"fields, and the prison",1
and the prison tuol,1
the prison tuol sleng,1
prison tuol sleng became,1
tuol sleng became known,1
sleng became known for,1
became known for its,1
known for its history,1
for its history of,1
its history of mass,1
history of mass killing,1
"of mass killing meanwhile,",1
"mass killing meanwhile, trade",1
"killing meanwhile, trade along",1
"meanwhile, trade along the",1
trade along the trans-saharan,1
along the trans-saharan route,1
the trans-saharan route intensified,1
trans-saharan route intensified thanks,1
route intensified thanks to,1
intensified thanks to advancements,1
thanks to advancements in,1
"to advancements in agriculture,",1
"advancements in agriculture, surplus",1
"in agriculture, surplus food",1
"agriculture, surplus food allowed",1
surplus food allowed these,1
food allowed these civilizations,1
allowed these civilizations to,1
these civilizations to support,1
civilizations to support larger,1
"to support larger populations,",1
"support larger populations, accompanied",1
"larger populations, accompanied by",1
"populations, accompanied by urbanization,",1
"accompanied by urbanization, the",1
"by urbanization, the establishment",1
"urbanization, the establishment of",1
the establishment of trade,1
"establishment of trade networks,",1
"of trade networks, and",1
"trade networks, and the",1
"networks, and the emergence",1
and the emergence of,1
the emergence of regional,1
emergence of regional empires,1
of regional empires the,1
regional empires the nature,1
empires the nature of,1
the nature of the,1
nature of the past,1
"of the past itself,",1
"the past itself, by",1
"past itself, by contrast,",1
"itself, by contrast, is",1
"by contrast, is static",1
"contrast, is static and",1
is static and unchangeable,1
static and unchangeable journalists,1
and unchangeable journalists covering,1
unchangeable journalists covering a,1
journalists covering a protest,1
covering a protest over,1
a protest over disputed,1
protest over disputed election,1
over disputed election results,1
disputed election results in,1
election results in phnom,1
results in phnom penh,1
in phnom penh on,2
phnom penh on 22,1
penh on 22 september,1
on 22 september 2013,1
22 september 2013 say,1
september 2013 say they,1
2013 say they were,1
say they were deliberately,1
they were deliberately attacked,1
were deliberately attacked by,1
deliberately attacked by police,1
attacked by police and,1
by police and men,1
police and men in,1
and men in plain,1
"men in plain clothes,",1
"in plain clothes, with",1
"plain clothes, with slingshots",1
"clothes, with slingshots and",1
with slingshots and stun,1
slingshots and stun guns,1
and stun guns with,1
stun guns with the,1
"guns with the renaissance,",1
"with the renaissance, older",1
"the renaissance, older senses",1
"renaissance, older senses of",1
older senses of the,1
senses of the word,1
of the word were,1
"the word were revived,",1
"word were revived, and",1
"were revived, and it",1
"revived, and it was",1
and it was in,1
it was in the,1
was in the greek,1
in the greek sense,1
the greek sense that,1
greek sense that francis,1
sense that francis bacon,1
that francis bacon used,1
francis bacon used the,1
bacon used the term,1
used the term in,1
the term in the,1
term in the late,1
in the late 16th,1
"the late 16th century,",1
"late 16th century, when",1
"16th century, when he",1
"century, when he wrote",1
when he wrote about,1
he wrote about natural,1
wrote about natural history,1
about natural history other,1
natural history other definitions,1
history other definitions see,1
other definitions see social,1
definitions see social history,1
see social history as,1
social history as the,1
history as the study,1
as the study of,2
the study of social,1
"study of social problems,",1
"of social problems, like",1
"social problems, like poverty,",1
"problems, like poverty, disease,",1
"like poverty, disease, and",1
"poverty, disease, and crime,",1
"disease, and crime, or",1
"and crime, or take",1
"crime, or take a",1
or take a broader,1
take a broader perspective,1
a broader perspective by,1
broader perspective by examining,1
perspective by examining how,1
by examining how whole,1
examining how whole societies,1
how whole societies developed,1
whole societies developed it,1
societies developed it is,1
developed it is possible,1
it is possible for,1
is possible for historians,1
possible for historians to,1
for historians to concern,1
historians to concern themselves,1
to concern themselves with,1
concern themselves with both,1
themselves with both the,1
with both the very,1
both the very specific,1
the very specific and,1
very specific and the,1
specific and the very,1
"and the very general,",1
"the very general, though",1
"very general, though the",1
"general, though the trend",1
though the trend has,1
the trend has been,1
trend has been toward,1
has been toward specialization,1
been toward specialization for,1
"toward specialization for example,",1
"specialization for example, the",1
"for example, the three-age",1
"example, the three-age system",1
the three-age system divides,1
three-age system divides early,1
system divides early human,1
divides early human history,1
early human history into,1
human history into stone,1
"history into stone age,",1
"into stone age, bronze",1
"stone age, bronze age,",1
"age, bronze age, and",1
"bronze age, and iron",1
"age, and iron age",1
and iron age based,1
iron age based on,1
age based on the,1
based on the predominant,1
on the predominant materials,1
the predominant materials and,1
predominant materials and technologies,1
materials and technologies during,1
and technologies during these,1
technologies during these periods,1
during these periods donors,1
these periods donors pledged,1
periods donors pledged $504,1
donors pledged $504 million,1
pledged $504 million to,1
$504 million to the,1
million to the country,1
to the country in,1
"the country in 2004,",2
"country in 2004, while",1
"in 2004, while the",1
"2004, while the asian",1
while the asian development,1
the asian development bank,2
asian development bank alone,1
development bank alone has,1
bank alone has provided,1
alone has provided $850,1
has provided $850 million,1
provided $850 million in,1
"$850 million in loans,",1
"million in loans, grants,",1
"in loans, grants, and",1
"loans, grants, and technical",1
"grants, and technical assistance'",1
and technical assistance' cambodia,1
technical assistance' cambodia signed,1
assistance' cambodia signed the,1
cambodia signed the un,1
signed the un treaty,1
the un treaty on,1
un treaty on the,1
treaty on the prohibition,1
on the prohibition of,1
the prohibition of nuclear,1
prohibition of nuclear weapons,1
of nuclear weapons most,1
nuclear weapons most sports,1
weapons most sports take,1
most sports take place,1
sports take place either,1
take place either in,1
place either in teams,1
either in teams or,1
in teams or competing,1
teams or competing as,1
or competing as individuals2%,1
competing as individuals2% of,1
as individuals2% of women),1
individuals2% of women) like,1
of women) like social,1
"women) like social scientists,",1
"like social scientists, historians",1
"social scientists, historians formulate",1
"scientists, historians formulate hypotheses,",1
"historians formulate hypotheses, gather",1
"formulate hypotheses, gather objective",1
"hypotheses, gather objective evidence,",1
"gather objective evidence, and",1
"objective evidence, and present",1
"evidence, and present arguments",1
and present arguments based,1
present arguments based on,1
arguments based on this,1
based on this evidence,1
on this evidence history,1
this evidence history further,1
evidence history further examines,1
history further examines the,1
further examines the meaning,1
examines the meaning of,1
the meaning of historical,1
meaning of historical events,1
of historical events and,1
historical events and the,1
events and the underlying,1
and the underlying human,1
the underlying human motives,1
underlying human motives driving,1
human motives driving them,1
motives driving them legislative,1
driving them legislative powers,1
them legislative powers are,1
legislative powers are shared,1
powers are shared by,1
are shared by the,1
shared by the executive,1
by the executive and,1
the executive and the,1
executive and the bicameral,1
and the bicameral parliament,1
the bicameral parliament of,1
bicameral parliament of cambodia,1
"parliament of cambodia (សភាតំណាងរាស្ត្រ,",1
"of cambodia (សភាតំណាងរាស្ត្រ, sâphéa",1
"cambodia (សភាតំណាងរាស្ត្រ, sâphéa tâmnang",1
"(សភាតំណាងរាស្ត្រ, sâphéa tâmnang réastrâ),",1
"sâphéa tâmnang réastrâ), which",1
"tâmnang réastrâ), which consists",1
"réastrâ), which consists of",1
which consists of a,1
consists of a lower,1
"of a lower house,",1
"a lower house, the",1
"lower house, the national",1
"house, the national assembly",1
"the national assembly (រដ្ឋសភា,",1
"national assembly (រដ្ឋសភា, rôdthâsâphéa)",1
"assembly (រដ្ឋសភា, rôdthâsâphéa) and",1
"(រដ្ឋសភា, rôdthâsâphéa) and an",1
rôdthâsâphéa) and an upper,1
"and an upper house,",1
"an upper house, the",1
"upper house, the senate",1
"house, the senate (ព្រឹទ្ធសភា,",1
"the senate (ព្រឹទ្ធសភា, prœ̆tthôsâphéa)",1
"senate (ព្រឹទ្ធសភា, prœ̆tthôsâphéa) in",1
"(ព្រឹទ្ធសភា, prœ̆tthôsâphéa) in the",1
prœ̆tthôsâphéa) in the first,1
in the first half,1
the first half of,1
"first half of 2013,",1
"half of 2013, the",1
"of 2013, the garment",1
"2013, the garment industry",1
the garment industry reported,1
garment industry reported exports,1
industry reported exports worth,1
reported exports worth $1,1
exports worth $1 the,1
worth $1 the directive,1
$1 the directive cited,1
the directive cited the,1
directive cited the fact,1
cited the fact that,1
"the fact that ""some",1
"fact that ""some foreigners",1
"that ""some foreigners have",1
"""some foreigners have used",1
foreigners have used this,1
have used this form,1
used this form of,1
this form of gambling,1
form of gambling to,1
of gambling to cheat,1
gambling to cheat victims,1
to cheat victims inside,1
cheat victims inside and,1
victims inside and outside,1
inside and outside the,1
"and outside the country""",1
"outside the country"" as",1
"the country"" as justifying",1
"country"" as justifying the",1
as justifying the new,1
justifying the new policy,1
the new policy rank,1
new policy rank name,1
policy rank name province,1
rank name province pop,2
name province pop the,1
province pop the english,1
pop the english cambodia,1
the english cambodia is,1
english cambodia is an,1
cambodia is an anglicisation,1
is an anglicisation of,1
an anglicisation of the,1
anglicisation of the french,1
"of the french cambodge,",1
"the french cambodge, which",1
"french cambodge, which in",1
"cambodge, which in turn",1
which in turn is,1
in turn is the,1
turn is the french,1
is the french transliteration,1
the french transliteration of,1
french transliteration of the,1
transliteration of the khmer,1
of the khmer កម្ពុជា,1
"the khmer កម្ពុជា (kâmpŭchéa,",1
"khmer កម្ពុជា (kâmpŭchéa, pronounced",1
"កម្ពុជា (kâmpŭchéa, pronounced [kampuciə])",1
"(kâmpŭchéa, pronounced [kampuciə]) others",1
pronounced [kampuciə]) others some,1
[kampuciə]) others some branches,1
others some branches of,1
some branches of history,1
branches of history are,2
of history are characterized,1
history are characterized by,1
are characterized by the,1
characterized by the methods,1
by the methods they,1
"the methods they employ,",1
"methods they employ, such",1
"they employ, such as",1
"employ, such as quantitative",1
such as quantitative history,1
as quantitative history and,1
quantitative history and digital,1
"history and digital history,",1
"and digital history, which",1
"digital history, which rely",1
"history, which rely on",1
which rely on quantitative,1
rely on quantitative methods,1
on quantitative methods and,1
quantitative methods and digital,1
methods and digital media,1
and digital media the,1
digital media the annales,1
media the annales school,1
the annales school highlights,1
annales school highlights long-term,1
school highlights long-term social,1
highlights long-term social and,1
long-term social and economic,1
social and economic trends,1
and economic trends while,1
economic trends while relying,1
trends while relying on,1
while relying on quantitative,1
relying on quantitative and,1
on quantitative and interdisciplinary,1
quantitative and interdisciplinary methods,1
and interdisciplinary methods the,1
interdisciplinary methods the lines,1
methods the lines run,1
the lines run from,1
lines run from the,1
run from the capital,1
from the capital to,1
the capital to sihanoukville,1
capital to sihanoukville on,1
to sihanoukville on the,1
sihanoukville on the southern,1
on the southern coast,1
the southern coast in,1
southern coast in recent,1
coast in recent years,1
in recent years the,1
recent years the use,1
years the use of,1
the use of sport,1
use of sport to,1
of sport to reduce,1
"sport to reduce crime,",1
"to reduce crime, as",1
"reduce crime, as well",1
"crime, as well as",1
as well as to,1
well as to prevent,1
as to prevent violent,1
to prevent violent extremism,1
prevent violent extremism and,1
"violent extremism and radicalization,",1
"extremism and radicalization, has",1
"and radicalization, has become",1
"radicalization, has become more",1
"has become more widespread,",1
"become more widespread, especially",1
"more widespread, especially as",1
"widespread, especially as a",1
especially as a tool,1
as a tool to,1
a tool to improve,1
"tool to improve self-esteem,",1
"to improve self-esteem, enhance",1
"improve self-esteem, enhance social",1
"self-esteem, enhance social bonds",1
enhance social bonds and,1
social bonds and provide,1
bonds and provide participants,1
and provide participants with,1
provide participants with a,1
participants with a feeling,1
with a feeling of,1
a feeling of purpose,1
feeling of purpose ethnic,1
of purpose ethnic groups,1
purpose ethnic groups further,1
ethnic groups further information:,1
groups further information: ethnic,1
further information: ethnic groups,1
information: ethnic groups in,1
ethnic groups in cambodia,1
groups in cambodia an,1
in cambodia an ethnic,1
cambodia an ethnic map,1
an ethnic map of,1
ethnic map of cambodia,1
map of cambodia the,1
of cambodia the vast,1
cambodia the vast majority,1
the vast majority of,1
vast majority of cambodia's,1
majority of cambodia's population,1
of cambodia's population is,1
cambodia's population is of,1
population is of ethnic,1
is of ethnic khmer,1
of ethnic khmer origin,1
ethnic khmer origin (95,1
khmer origin (95 the,1
origin (95 the education,1
(95 the education system,1
the education system in,1
education system in cambodia,1
system in cambodia continues,1
in cambodia continues to,1
cambodia continues to face,1
continues to face many,1
"to face many challenges,",1
"face many challenges, but",1
"many challenges, but during",1
"challenges, but during the",1
but during the past,1
"during the past years,",1
"the past years, there",1
"past years, there have",1
"years, there have been",1
there have been significant,1
"have been significant improvements,",1
"been significant improvements, especially",1
"significant improvements, especially in",1
"improvements, especially in terms",1
especially in terms of,1
in terms of primary,1
terms of primary net,1
of primary net enrolment,1
"primary net enrolment gains,",1
"net enrolment gains, the",1
"enrolment gains, the introduction",1
"gains, the introduction of",1
the introduction of program,1
"introduction of program based-budgeting,",1
"of program based-budgeting, and",1
"program based-budgeting, and the",1
"based-budgeting, and the development",1
and the development of,3
the development of a,1
development of a policy,1
of a policy framework,1
a policy framework which,1
policy framework which helps,1
framework which helps disadvantaged,1
which helps disadvantaged children,1
helps disadvantaged children to,1
disadvantaged children to gain,1
children to gain access,1
to gain access to,1
gain access to education,1
access to education academic,1
to education academic historians,1
education academic historians have,1
academic historians have often,1
historians have often fought,1
have often fought against,1
often fought against the,1
fought against the politicization,1
against the politicization of,1
the politicization of the,1
"politicization of the textbooks,",1
"of the textbooks, sometimes",1
"the textbooks, sometimes with",1
"textbooks, sometimes with success",1
sometimes with success another,1
with success another methodological,1
success another methodological tool,1
another methodological tool is,1
methodological tool is the,1
tool is the examination,1
is the examination of,1
"the examination of silences,",1
"examination of silences, gaps",1
"of silences, gaps or",1
"silences, gaps or omissions",1
gaps or omissions in,1
or omissions in the,1
omissions in the historical,1
in the historical record,1
the historical record of,1
historical record of events,1
record of events that,1
of events that occurred,1
events that occurred but,1
that occurred but did,1
occurred but did not,1
but did not leave,1
did not leave significant,1
not leave significant evidential,1
leave significant evidential traces,1
significant evidential traces a,1
evidential traces a related,1
traces a related perspective,1
a related perspective focuses,1
related perspective focuses on,1
perspective focuses on a,1
focuses on a general,1
on a general understanding,1
a general understanding of,1
general understanding of the,1
understanding of the human,1
"of the human condition,",1
"the human condition, making",1
"human condition, making people",1
"condition, making people aware",1
making people aware of,1
people aware of the,1
aware of the diversity,1
of the diversity of,1
the diversity of human,1
diversity of human behaviour,1
of human behaviour across,1
human behaviour across different,1
behaviour across different contexts—similar,1
across different contexts—similar to,1
different contexts—similar to what,1
contexts—similar to what one,1
to what one can,1
what one can learn,1
one can learn by,1
can learn by visiting,1
learn by visiting foreign,1
by visiting foreign countries,1
