word,count
swimmers' performances a wide,1
performances a wide range,1
a wide range of,1
wide range of sports,1
range of sports were,1
of sports were already,1
sports were already established,1
were already established by,1
already established by the,1
established by the time,1
by the time of,1
the time of ancient,1
time of ancient greece,1
of ancient greece and,1
ancient greece and the,1
greece and the military,1
and the military culture,1
the military culture and,1
military culture and the,1
culture and the development,1
the development of sport,1
development of sport in,1
of sport in greece,1
sport in greece influenced,1
in greece influenced one,1
greece influenced one another,1
influenced one another considerably,1
one another considerably cambodia,1
another considerably cambodia is,1
considerably cambodia is the,1
cambodia is the 70th,1
is the 70th most,1
the 70th most peaceful,1
70th most peaceful country,1
most peaceful country in,1
peaceful country in the,1
"country in the world,",1
"in the world, according",1
"the world, according to",1
"world, according to the",1
according to the 2024,1
to the 2024 global,1
the 2024 global peace,1
2024 global peace index,1
global peace index it,1
peace index it is,1
index it is bordered,1
it is bordered by,1
is bordered by thailand,1
bordered by thailand to,1
by thailand to the,1
"thailand to the northwest,",1
"to the northwest, laos",1
"the northwest, laos to",1
"northwest, laos to the",1
"laos to the north,",1
"to the north, vietnam",1
"the north, vietnam to",1
"north, vietnam to the",1
"vietnam to the east,",1
"to the east, and",1
"the east, and has",1
"east, and has a",1
and has a coastline,1
has a coastline along,1
a coastline along the,1
coastline along the gulf,2
along the gulf of,2
gulf of thailand in,1
of thailand in the,1
thailand in the southwest,1
in the southwest the,1
the southwest the lon,1
southwest the lon nol,1
the lon nol government,1
lon nol government in,1
nol government in phnom,1
government in phnom penh,1
in phnom penh surrendered,1
phnom penh surrendered on,1
penh surrendered on 17,1
surrendered on 17 april,1
"on 17 april 1975,",1
"17 april 1975, 5",1
"april 1975, 5 days",1
"1975, 5 days after",1
5 days after the,1
days after the us,1
after the us mission,1
the us mission evacuated,1
us mission evacuated cambodia,1
mission evacuated cambodia under,1
evacuated cambodia under the,1
cambodia under the reign,1
under the reign of,1
the reign of king,1
reign of king norodom,1
"of king norodom sihanouk,",1
"king norodom sihanouk, cambodia",1
"norodom sihanouk, cambodia gained",1
"sihanouk, cambodia gained independence",1
cambodia gained independence from,1
gained independence from france,1
independence from france on,1
from france on 9,1
france on 9 november,1
on 9 november 1953,1
9 november 1953 ±%,1
november 1953 ±% p,1
1953 ±% p part,1
±% p part of,1
p part of a,1
part of a series,1
of a series on,1
a series on history,1
series on history study,1
on history study of,1
history study of the,1
study of the past,1
of the past indexoutlineglossary,1
the past indexoutlineglossary key,1
past indexoutlineglossary key concepts,1
indexoutlineglossary key concepts periods,1
key concepts periods by,1
concepts periods by region,1
periods by region notable,1
by region notable historians,1
region notable historians timelines,1
notable historians timelines history,1
historians timelines history portal,1
timelines history portal category,1
history portal category vte,1
portal category vte history,1
category vte history (derived,1
vte history (derived from,1
history (derived from ancient,1
(derived from ancient greek,1
from ancient greek ἱστορία,1
ancient greek ἱστορία (historía),1
greek ἱστορία (historía) 'inquiry;,1
ἱστορία (historía) 'inquiry; knowledge,1
(historía) 'inquiry; knowledge acquired,1
'inquiry; knowledge acquired by,1
knowledge acquired by investigation'),1
acquired by investigation') is,1
by investigation') is the,1
investigation') is the systematic,1
is the systematic study,1
the systematic study and,1
systematic study and documentation,1
study and documentation of,1
and documentation of the,1
documentation of the human,1
of the human past,1
the human past cambodian,1
human past cambodian culture,1
past cambodian culture not,1
cambodian culture not only,1
culture not only includes,1
not only includes the,1
only includes the culture,1
includes the culture of,1
the culture of the,1
culture of the lowland,1
of the lowland ethnic,1
"the lowland ethnic majority,",1
"lowland ethnic majority, but",1
"ethnic majority, but also",1
"majority, but also some",1
but also some 20,1
also some 20 culturally,1
some 20 culturally distinct,1
20 culturally distinct hill,1
culturally distinct hill tribes,1
distinct hill tribes colloquially,1
hill tribes colloquially known,1
tribes colloquially known as,1
colloquially known as the,1
known as the khmer,1
"as the khmer loeu,",1
"the khmer loeu, a",1
"khmer loeu, a term",1
"loeu, a term coined",1
a term coined by,1
term coined by norodom,1
coined by norodom sihanouk,1
by norodom sihanouk to,1
norodom sihanouk to encourage,1
sihanouk to encourage unity,1
to encourage unity between,1
encourage unity between the,1
unity between the highlanders,1
between the highlanders and,1
the highlanders and lowlanders8,1
highlanders and lowlanders8 metres,1
and lowlanders8 metres (5,1
lowlanders8 metres (5 in,1
metres (5 in this,1
"(5 in this sense,",1
"in this sense, history",1
"this sense, history is",1
"sense, history is what",1
history is what happened,1
is what happened rather,1
what happened rather than,1
happened rather than the,1
rather than the academic,1
than the academic field,1
the academic field studying,1
academic field studying what,1
field studying what happened,1
studying what happened the,1
what happened the teaching,1
happened the teaching of,1
the teaching of history,2
teaching of history in,1
of history in french,1
history in french schools,1
in french schools was,1
french schools was influenced,1
schools was influenced by,1
was influenced by the,1
influenced by the nouvelle,1
by the nouvelle histoire,1
the nouvelle histoire as,1
nouvelle histoire as disseminated,1
histoire as disseminated after,1
as disseminated after the,1
disseminated after the 1960s,1
after the 1960s by,1
the 1960s by cahiers,1
1960s by cahiers pédagogiques,1
by cahiers pédagogiques and,1
cahiers pédagogiques and enseignement,1
pédagogiques and enseignement and,1
and enseignement and other,1
enseignement and other journals,1
and other journals for,1
other journals for teachers,1
journals for teachers participation,1
for teachers participation gender,1
teachers participation gender participation,1
participation gender participation see,1
gender participation see also:,1
participation see also: women's,1
see also: women's sports,1
also: women's sports and,1
women's sports and women's,1
sports and women's professional,1
and women's professional sports,1
women's professional sports international,1
professional sports international level,1
sports international level female,1
international level female athletes,1
level female athletes at,1
female athletes at istaf,1
"athletes at istaf berlin,",1
"at istaf berlin, 2006",1
"istaf berlin, 2006 female",1
"berlin, 2006 female participation",1
2006 female participation in,1
female participation in sports,1
participation in sports continues,1
in sports continues to,1
sports continues to rise,1
continues to rise alongside,1
to rise alongside the,1
rise alongside the opportunity,1
alongside the opportunity for,1
the opportunity for involvement,1
opportunity for involvement and,1
for involvement and the,1
involvement and the value,1
and the value of,1
the value of sports,1
value of sports for,1
of sports for child,1
sports for child development,1
for child development and,1
child development and physical,1
development and physical fitness,1
and physical fitness norodom,1
physical fitness norodom sihamoni,1
fitness norodom sihamoni was,1
norodom sihamoni was crowned,1
sihamoni was crowned cambodia's,1
was crowned cambodia's king,1
crowned cambodia's king in,1
cambodia's king in 2004,1
king in 2004 after,1
in 2004 after his,1
2004 after his father,1
after his father sihanouk's,1
his father sihanouk's abdication,1
father sihanouk's abdication one,1
sihanouk's abdication one example,1
abdication one example of,1
one example of this,1
example of this is,1
"of this is baseball5,",1
"this is baseball5, which",1
"is baseball5, which is",1
"baseball5, which is the",1
which is the first,1
is the first mixed-gender,1
the first mixed-gender sport,1
first mixed-gender sport to,1
mixed-gender sport to have,1
sport to have been,1
to have been admitted,1
have been admitted into,1
been admitted into an,1
admitted into an olympic,1
into an olympic event,1
an olympic event it,1
olympic event it also,1
event it also had,1
it also had a,1
also had a severe,1
had a severe economic,1
"a severe economic impact,",1
"severe economic impact, with",1
"economic impact, with the",1
"impact, with the tourism",1
with the tourism industry,1
the tourism industry particularly,1
tourism industry particularly affected,1
industry particularly affected due,1
particularly affected due to,1
affected due to international,1
due to international travel,1
to international travel restrictions,1
international travel restrictions cambodia,1
travel restrictions cambodia is,1
restrictions cambodia is a,1
cambodia is a member,2
member of the united,1
"of the united nations,",1
"the united nations, asean,",1
"united nations, asean, the",1
"nations, asean, the rcep,",1
"asean, the rcep, the",1
"the rcep, the east",1
"rcep, the east asia",1
"the east asia summit,",1
"east asia summit, the",1
"asia summit, the wto,",1
"summit, the wto, the",1
"the wto, the non-aligned",1
"wto, the non-aligned movement",1
the non-aligned movement and,1
non-aligned movement and la,1
"movement and la francophonie,",1
"and la francophonie, and",1
"la francophonie, and a",1
"francophonie, and a dialogue",1
and a dialogue partner,1
a dialogue partner of,1
dialogue partner of the,1
partner of the shanghai,1
of the shanghai cooperation,1
the shanghai cooperation organisation,1
shanghai cooperation organisation male,1
cooperation organisation male youth,1
organisation male youth age,1
male youth age (15–24,1
youth age (15–24 years),1
age (15–24 years) have,1
(15–24 years) have a,1
years) have a literacy,1
have a literacy rate,1
a literacy rate of,1
literacy rate of 89%,1
rate of 89% compared,1
of 89% compared to,1
89% compared to 86%,1
compared to 86% for,1
to 86% for females,1
86% for females the,1
for females the arrival,1
females the arrival of,1
the arrival of the,2
arrival of the europeans,2
of the europeans in,1
the europeans in the,1
europeans in the 16th,1
in the 16th century,1
the 16th century prompted,1
16th century prompted significant,1
century prompted significant transformations,1
prompted significant transformations it,1
significant transformations it was,1
transformations it was standard,1
it was standard policy,1
was standard policy in,1
standard policy in communist,1
policy in communist countries,1
in communist countries to,1
communist countries to present,1
countries to present only,1
to present only a,1
present only a rigid,1
only a rigid marxist,1
a rigid marxist historiography,1
rigid marxist historiography prostitution,1
marxist historiography prostitution is,1
historiography prostitution is illegal,1
prostitution is illegal in,1
is illegal in cambodia,1
illegal in cambodia but,1
in cambodia but yet,1
cambodia but yet appears,1
but yet appears to,1
yet appears to be,1
appears to be prevalent,1
to be prevalent the,1
be prevalent the 2010,1
prevalent the 2010 anti-corruption,1
the 2010 anti-corruption law,1
2010 anti-corruption law provided,1
anti-corruption law provided no,1
law provided no protection,1
provided no protection to,1
"no protection to whistle-blowers,",1
"protection to whistle-blowers, and",1
"to whistle-blowers, and whistle-blowers",1
"whistle-blowers, and whistle-blowers can",1
and whistle-blowers can be,1
whistle-blowers can be jailed,1
can be jailed for,1
be jailed for up,1
jailed for up to,1
for up to 6,1
up to 6 months,1
to 6 months if,1
6 months if they,1
months if they report,1
if they report corruption,1
they report corruption that,1
report corruption that cannot,1
corruption that cannot be,1
that cannot be proven,1
cannot be proven its,1
be proven its capital,1
proven its capital and,1
its capital and most,1
capital and most populous,1
and most populous city,1
most populous city is,1
populous city is phnom,1
"city is phnom penh,",1
"is phnom penh, followed",1
"phnom penh, followed by",1
"penh, followed by siem",1
followed by siem reap,1
by siem reap and,1
siem reap and battambang,1
reap and battambang sport,1
and battambang sport is,1
battambang sport is generally,1
sport is generally recognised,1
is generally recognised as,1
generally recognised as system,1
recognised as system of,1
as system of activities,1
system of activities based,1
of activities based in,1
activities based in physical,1
based in physical athleticism,1
in physical athleticism or,1
physical athleticism or physical,1
"athleticism or physical dexterity,",1
"or physical dexterity, with",1
"physical dexterity, with major",1
"dexterity, with major competitions",1
with major competitions admitting,1
major competitions admitting only,1
competitions admitting only sports,1
admitting only sports meeting,1
only sports meeting this,1
sports meeting this definition,1
meeting this definition in,1
"this definition in cambodia,",1
"definition in cambodia, some",1
"in cambodia, some iron",1
"cambodia, some iron age",1
some iron age settlements,1
iron age settlements were,1
age settlements were found,1
settlements were found beneath,1
were found beneath baksei,1
found beneath baksei chamkrong,1
beneath baksei chamkrong and,1
baksei chamkrong and other,1
chamkrong and other angkorian,1
and other angkorian temples,1
other angkorian temples while,1
angkorian temples while circular,1
temples while circular earthworks,1
while circular earthworks were,1
circular earthworks were discovered,1
earthworks were discovered at,1
were discovered at the,1
discovered at the site,1
at the site of,1
the site of lovea,1
site of lovea kilometres,1
of lovea kilometres north-west,1
lovea kilometres north-west of,1
kilometres north-west of angkor6,1
north-west of angkor6 billion,1
of angkor6 billion counterfactual,1
angkor6 billion counterfactual history,1
billion counterfactual history uses,1
counterfactual history uses counterfactual,1
history uses counterfactual thinking,1
uses counterfactual thinking to,1
counterfactual thinking to examine,1
thinking to examine alternative,1
to examine alternative courses,1
examine alternative courses of,1
"alternative courses of history,",1
"courses of history, exploring",1
"of history, exploring what",1
"history, exploring what could",1
exploring what could have,1
what could have happened,1
could have happened under,1
have happened under different,1
happened under different circumstances,1
under different circumstances credible,1
different circumstances credible non-governmental,1
circumstances credible non-governmental organisations,1
credible non-governmental organisations estimate,1
non-governmental organisations estimate that,1
"organisations estimate that ""770,000",1
"estimate that ""770,000 people",1
"that ""770,000 people have",1
"""770,000 people have been",1
people have been adversely,1
have been adversely affected,1
been adversely affected by,1
adversely affected by land,1
affected by land grabbing,1
by land grabbing covering,1
land grabbing covering at,1
grabbing covering at least,1
covering at least four,1
at least four million,1
least four million hectares,1
four million hectares (nearly,1
million hectares (nearly 10,1
hectares (nearly 10 million,1
(nearly 10 million acres),1
10 million acres) of,1
million acres) of land,1
acres) of land that,1
of land that have,1
land that have been,1
"that have been confiscated"",",1
"have been confiscated"", says",1
"been confiscated"", says paris-based",1
"confiscated"", says paris-based international",1
says paris-based international federation,1
paris-based international federation for,1
international federation for human,1
federation for human rights,1
for human rights (fidh),1
human rights (fidh) with,1
rights (fidh) with increasing,1
(fidh) with increasing economic,1
with increasing economic activity,1
increasing economic activity has,1
economic activity has come,1
activity has come an,1
has come an increase,1
come an increase in,1
an increase in automobile,1
"increase in automobile use,",1
"in automobile use, though",1
"automobile use, though motorcycles",1
"use, though motorcycles still",1
though motorcycles still predominate,1
motorcycles still predominate a,1
still predominate a closely,1
predominate a closely related,1
a closely related approach,1
closely related approach focuses,1
related approach focuses on,1
approach focuses on experience,1
focuses on experience rather,1
on experience rather than,1
"experience rather than activities,",1
"rather than activities, examining",1
"than activities, examining how",1
"activities, examining how members",1
examining how members of,1
how members of particular,1
members of particular social,1
"of particular social groups,",1
"particular social groups, like",1
"social groups, like social",1
"groups, like social classes,",1
"like social classes, races,",1
"social classes, races, genders,",1
"classes, races, genders, or",1
"races, genders, or age",1
"genders, or age groups,",1
"or age groups, experienced",1
"age groups, experienced their",1
"groups, experienced their world",1
experienced their world a,1
their world a study,1
world a study of,1
a study of us,1
study of us elections,1
of us elections has,1
us elections has shown,1
elections has shown that,1
has shown that the,1
shown that the result,1
that the result of,1
the result of sports,1
result of sports events,1
of sports events can,1
sports events can affect,1
events can affect the,1
can affect the results,1
affect the results by,1
the results by the,1
results by the end,1
by the end of,1
the end of the,4
end of the 19th,1
"of the 19th century,",1
"the 19th century, most",1
"19th century, most of",1
"century, most of the",1
most of the region,1
of the region had,1
the region had come,1
region had come under,1
had come under western,1
come under western control,1
under western control hundreds,1
western control hundreds of,1
control hundreds of thousands,1
hundreds of thousands fled,1
of thousands fled across,1
thousands fled across the,1
fled across the border,1
across the border into,1
the border into neighbouring,1
border into neighbouring thailand,1
into neighbouring thailand excavations,1
neighbouring thailand excavations in,1
thailand excavations in its,1
excavations in its lower,1
in its lower layers,1
its lower layers produced,1
lower layers produced a,1
layers produced a series,1
produced a series of,1
a series of radiocarbon,1
series of radiocarbon dates,1
of radiocarbon dates around,1
radiocarbon dates around 6000,1
dates around 6000 bc4,1
around 6000 bc4 per,1
"6000 bc4 per 100,000",1
"bc4 per 100,000 population",1
"per 100,000 population technology",1
"100,000 population technology these",1
population technology these lights,1
technology these lights at,1
these lights at the,1
lights at the melbourne,1
at the melbourne cricket,1
the melbourne cricket ground,1
melbourne cricket ground indicate,1
cricket ground indicate the,1
ground indicate the decision,1
indicate the decision the,1
the decision the third,1
decision the third umpire,1
third umpire makes following,1
umpire makes following a,1
makes following a review,1
following a review cambodia's,1
a review cambodia's population,1
review cambodia's population is,1
cambodia's population is largely,1
population is largely homogeneous,1
is largely homogeneous the,1
largely homogeneous the mekong,1
homogeneous the mekong and,1
the mekong and the,1
mekong and the tonle,1
and the tonle sap,3
"the tonle sap river,",1
"tonle sap river, their",1
"sap river, their numerous",1
"river, their numerous tributaries,",1
"their numerous tributaries, and",1
"numerous tributaries, and the",1
"tributaries, and the tonle",1
the tonle sap provided,1
tonle sap provided avenues,1
sap provided avenues of,1
provided avenues of considerable,1
"avenues of considerable length,",1
"of considerable length, including",1
"considerable length, including 3,700",1
"length, including 3,700 kilometres",1
"including 3,700 kilometres (2,300",1
"3,700 kilometres (2,300 miles)",1
"kilometres (2,300 miles) navigable",1
"(2,300 miles) navigable all",1
miles) navigable all year,1
navigable all year by,1
all year by craft,1
year by craft drawing,1
by craft drawing 0,1
craft drawing 0 (april,1
drawing 0 (april 2024),1
0 (april 2024) (learn,1
(april 2024) (learn how,1
2024) (learn how and,1
(learn how and when,1
how and when to,1
and when to remove,1
when to remove this,1
to remove this message),1
remove this message) see,1
this message) see also:,1
message) see also: match,1
see also: match fixing,1
also: match fixing and,1
match fixing and cheating,1
fixing and cheating key,1
and cheating key principles,1
cheating key principles of,1
key principles of sport,1
principles of sport include,1
of sport include that,1
sport include that the,1
include that the result,1
that the result should,1
the result should not,1
result should not be,1
"should not be predetermined,",1
"not be predetermined, and",1
"be predetermined, and that",1
"predetermined, and that both",1
and that both sides,1
that both sides should,1
both sides should have,1
sides should have equal,1
should have equal opportunity,1
have equal opportunity to,1
equal opportunity to win,1
opportunity to win military,1
to win military history,1
win military history studies,1
military history studies the,1
history studies the impact,1
studies the impact and,1
the impact and development,1
impact and development of,1
and development of armed,1
development of armed conflicts,1
of armed conflicts in,1
armed conflicts in human,1
conflicts in human history,1
in human history for,1
"human history for example,",1
"history for example, mark",1
"for example, mark leone,",1
"example, mark leone, the",1
"mark leone, the excavator",1
"leone, the excavator and",1
the excavator and interpreter,1
excavator and interpreter of,1
and interpreter of historical,1
"interpreter of historical annapolis,",1
"of historical annapolis, maryland,",1
"historical annapolis, maryland, us,",1
"annapolis, maryland, us, has",1
"maryland, us, has sought",1
"us, has sought to",1
has sought to understand,1
sought to understand the,1
to understand the contradiction,1
understand the contradiction between,1
the contradiction between textual,1
contradiction between textual documents,1
between textual documents idealizing,1
"textual documents idealizing ""liberty""",1
"documents idealizing ""liberty"" and",1
"idealizing ""liberty"" and the",1
"""liberty"" and the material",1
"and the material record,",1
"the material record, demonstrating",1
"material record, demonstrating the",1
"record, demonstrating the possession",1
demonstrating the possession of,1
the possession of slaves,1
possession of slaves and,1
of slaves and the,1
slaves and the inequalities,1
and the inequalities of,1
the inequalities of wealth,1
inequalities of wealth made,1
of wealth made apparent,1
wealth made apparent by,1
made apparent by the,1
apparent by the study,1
by the study of,1
study of the total,1
of the total historical,1
the total historical environment,1
total historical environment the,1
historical environment the study,1
environment the study of,1
the study of history,2
study of history has,1
of history has sometimes,1
history has sometimes been,1
has sometimes been classified,1
sometimes been classified as,1
been classified as part,1
classified as part of,1
as part of the,1
"part of the humanities,",1
"of the humanities, other",1
"the humanities, other times",1
"humanities, other times part",1
other times part of,1
times part of the,1
part of the social,1
of the social sciences,1
the social sciences since,1
"social sciences since 2007,",1
"sciences since 2007, less",1
"since 2007, less than",1
"2007, less than 3,220",1
"less than 3,220 km2",1
"than 3,220 km2 (1,243",1
"3,220 km2 (1,243 sq",1
"km2 (1,243 sq mi)",1
"(1,243 sq mi) of",1
sq mi) of primary,1
mi) of primary forest,1
of primary forest remain,1
primary forest remain with,1
forest remain with the,1
remain with the result,1
with the result that,1
the result that the,1
result that the future,1
that the future sustainability,1
the future sustainability of,1
future sustainability of the,1
sustainability of the forest,1
of the forest reserves,1
the forest reserves of,1
forest reserves of cambodia,1
reserves of cambodia is,1
of cambodia is under,1
cambodia is under severe,1
is under severe threat,1
under severe threat when,1
severe threat when prepared,1
threat when prepared with,1
when prepared with macerated,1
prepared with macerated fruits,1
with macerated fruits or,1
"macerated fruits or spices,",1
"fruits or spices, like",1
"or spices, like the",1
"spices, like the sombai",1
"like the sombai liqueur,",1
"the sombai liqueur, it",1
"sombai liqueur, it is",1
"liqueur, it is called",1
it is called sra,1
is called sra tram,1
called sra tram (soaked,1
sra tram (soaked wine),1
"tram (soaked wine) ""children",1
"(soaked wine) ""children taking",1
"wine) ""children taking part",1
"""children taking part in",1
"taking part in sport""),",1
"part in sport""), with",1
"in sport""), with ""sports""",1
"sport""), with ""sports"" used",1
"with ""sports"" used to",1
"""sports"" used to describe",1
used to describe multiple,1
to describe multiple activities,1
describe multiple activities (e,1
