word,count
disputes between cambodia and,1
between cambodia and its,1
cambodia and its neighbours,1
and its neighbours persist,1
its neighbours persist as,1
neighbours persist as a,1
persist as a result,1
as a result of,2
a result of its,1
result of its international,1
"of its international relations,",1
"its international relations, various",1
"international relations, various charitable",1
"relations, various charitable organisations",1
various charitable organisations have,1
charitable organisations have assisted,1
organisations have assisted with,1
"have assisted with social,",1
"assisted with social, economic,",1
"with social, economic, and",1
"social, economic, and civil",1
"economic, and civil infrastructure",1
and civil infrastructure needs,1
civil infrastructure needs cambodia's,1
infrastructure needs cambodia's extensive,1
needs cambodia's extensive inland,1
cambodia's extensive inland waterways,1
extensive inland waterways were,1
inland waterways were important,1
waterways were important historically,1
were important historically in,1
important historically in international,1
historically in international trade,1
"in international trade today,",1
"international trade today, history",1
"trade today, history has",1
"today, history has a",1
history has a broader,1
has a broader scope,1
a broader scope that,1
broader scope that includes,1
"scope that includes prehistory,",1
"that includes prehistory, starting",1
"includes prehistory, starting with",1
"prehistory, starting with the",1
starting with the earliest,1
with the earliest human,1
the earliest human origins,1
earliest human origins several,1
human origins several million,1
origins several million years,1
several million years ago,1
"million years ago 1462)""",1
"years ago 1462)"" some",1
"ago 1462)"" some of",1
"1462)"" some of the",1
some of the fish,1
of the fish can,1
the fish can be,1
fish can be made,1
can be made into,1
be made into prahok,1
made into prahok for,1
into prahok for longer,1
prahok for longer storage,1
for longer storage the,1
longer storage the country,1
storage the country experiences,1
the country experiences the,1
country experiences the heaviest,1
experiences the heaviest precipitation,1
the heaviest precipitation from,1
heaviest precipitation from september,1
precipitation from september to,1
from september to october,1
september to october with,1
to october with the,1
october with the driest,1
with the driest period,1
the driest period occurring,1
driest period occurring from,1
period occurring from january,1
occurring from january to,1
from january to february,1
january to february in,1
to february in the,1
february in the united,1
"the united states, scholarship",1
"united states, scholarship was",1
"states, scholarship was concentrated",1
scholarship was concentrated at,1
was concentrated at the,1
concentrated at the major,1
at the major phd-producing,1
"the major phd-producing universities,",1
"major phd-producing universities, while",1
"phd-producing universities, while the",1
"universities, while the large",1
while the large number,1
the large number of,1
large number of other,1
number of other colleges,1
of other colleges and,1
other colleges and universities,1
colleges and universities focused,1
and universities focused on,1
universities focused on undergraduate,1
focused on undergraduate teaching,1
on undergraduate teaching in,1
undergraduate teaching in the,1
teaching in the history,1
in the history of,1
"the history of ireland,",1
"history of ireland, gaelic",1
"of ireland, gaelic sports",1
"ireland, gaelic sports were",1
gaelic sports were connected,1
sports were connected with,1
were connected with cultural,1
connected with cultural nationalism,1
"with cultural nationalism traditionally,",1
"cultural nationalism traditionally, the",1
"nationalism traditionally, the khmer",1
"traditionally, the khmer people",1
the khmer people have,1
khmer people have a,1
people have a recorded,1
have a recorded information,1
a recorded information on,1
recorded information on tra,1
information on tra leaves,1
on tra leaves from,1
tra leaves from the,1
leaves from the late,1
from the late 18th,1
the late 18th to,1
late 18th to the,1
18th to the early,1
to the early 20th,1
"the early 20th centuries,",1
"early 20th centuries, european",1
"20th centuries, european global",1
"centuries, european global dominance",1
european global dominance was,1
global dominance was further,1
dominance was further solidified,1
was further solidified by,1
further solidified by the,1
solidified by the industrial,1
by the industrial revolution,1
the industrial revolution and,1
industrial revolution and the,1
revolution and the establishment,1
and the establishment of,2
the establishment of large,1
establishment of large overseas,1
of large overseas colonies,1
large overseas colonies favouritism,1
overseas colonies favouritism by,1
colonies favouritism by government,1
favouritism by government officials,1
by government officials and,1
government officials and impunity,1
officials and impunity is,1
and impunity is commonplace,1
impunity is commonplace upon,1
is commonplace upon his,1
commonplace upon his father's,1
upon his father's death,1
his father's death in,1
"father's death in 1960,",1
"death in 1960, sihanouk",1
"in 1960, sihanouk again",1
"1960, sihanouk again became",1
sihanouk again became head,1
again became head of,1
"became head of state,",1
"head of state, taking",1
"of state, taking the",1
"state, taking the title",1
taking the title of,1
the title of prince,1
title of prince disabled,1
of prince disabled participation,1
prince disabled participation see,1
disabled participation see also:,1
participation see also: parasports,1
see also: parasports a,1
also: parasports a runner,1
parasports a runner gives,1
a runner gives a,1
runner gives a friendly,1
gives a friendly tap,1
a friendly tap on,1
friendly tap on the,1
tap on the shoulder,1
on the shoulder to,1
the shoulder to a,1
shoulder to a wheelchair,1
to a wheelchair racer,1
a wheelchair racer during,1
wheelchair racer during the,1
racer during the marathon,1
during the marathon international,1
the marathon international de,1
marathon international de paris,1
international de paris (paris,1
de paris (paris marathon),1
paris (paris marathon) in,1
(paris marathon) in 2014,1
marathon) in 2014 crime,1
in 2014 crime further,1
2014 crime further information:,1
crime further information: crime,1
further information: crime in,1
information: crime in cambodia,1
crime in cambodia in,1
"in cambodia in 2017,",1
"cambodia in 2017, cambodia",1
"in 2017, cambodia had",1
"2017, cambodia had a",1
cambodia had a homicide,1
had a homicide rate,1
a homicide rate of,1
homicide rate of 2,1
rate of 2 in,1
of 2 in early,1
2 in early modern,1
"in early modern history,",1
"early modern history, starting",1
"modern history, starting roughly",1
"history, starting roughly 1500",1
"starting roughly 1500 ce,",1
"roughly 1500 ce, european",1
"1500 ce, european states",1
"ce, european states rose",1
european states rose to,1
states rose to global,1
rose to global power,1
"to global power colloquially,",1
"global power colloquially, cambodians",1
"power colloquially, cambodians refer",1
"colloquially, cambodians refer to",1
cambodians refer to their,1
refer to their country,1
to their country as,1
their country as either,1
country as either srok,1
as either srok khmer,1
either srok khmer (ស្រុកខ្មែរ,1
srok khmer (ស្រុកខ្មែរ srŏk,1
"khmer (ស្រុកខ្មែរ srŏk khmêr,",1
"(ស្រុកខ្មែរ srŏk khmêr, pronounced",1
"srŏk khmêr, pronounced [srok",1
"khmêr, pronounced [srok kʰmae];",1
pronounced [srok kʰmae]; meaning,1
"[srok kʰmae]; meaning ""land",1
"kʰmae]; meaning ""land of",1
"meaning ""land of the",1
"""land of the khmers""),",1
"of the khmers""), or",1
"the khmers""), or the",1
"khmers""), or the slightly",1
or the slightly more,1
the slightly more formal,1
slightly more formal ប្រទេសកម្ពុជា,1
more formal ប្រទេសកម្ពុជា (prâtés,1
"formal ប្រទេសកម្ពុជា (prâtés kâmpŭchéa,",1
"ប្រទេសកម្ពុជា (prâtés kâmpŭchéa, pronounced",1
"(prâtés kâmpŭchéa, pronounced [prɑteh",1
"kâmpŭchéa, pronounced [prɑteh kampuciə];",1
"pronounced [prɑteh kampuciə]; ""country",1
"[prɑteh kampuciə]; ""country of",1
"kampuciə]; ""country of kampuchea"")",1
"""country of kampuchea"") masked",1
"of kampuchea"") masked men",1
"kampuchea"") masked men entered",1
masked men entered the,1
men entered the hotel,1
entered the hotel of,1
the hotel of the,1
hotel of the israeli,1
of the israeli olympic,1
the israeli olympic team,1
israeli olympic team and,1
olympic team and killed,1
team and killed many,1
and killed many of,1
killed many of their,1
many of their men,1
of their men based,1
their men based on,1
men based on the,1
"based on the economist,",1
"on the economist, imf:",1
"the economist, imf: annual",1
"economist, imf: annual average",1
imf: annual average gdp,1
annual average gdp growth,2
average gdp growth for,1
gdp growth for the,1
growth for the period,1
for the period 2001–2010,1
the period 2001–2010 was,1
period 2001–2010 was 7,1
2001–2010 was 7 the,1
was 7 the country,1
7 the country has,1
the country has also,1
country has also significantly,1
has also significantly invested,1
also significantly invested in,1
significantly invested in vocational,1
"invested in vocational education,",1
"in vocational education, especially",1
"vocational education, especially in",1
"education, especially in rural",1
"especially in rural areas,",1
"in rural areas, to",1
"rural areas, to tackle",1
"areas, to tackle poverty",1
to tackle poverty and,1
tackle poverty and unemployment,1
poverty and unemployment it,1
and unemployment it appears,1
unemployment it appears in,1
it appears in the,1
appears in the 13th-century,1
in the 13th-century ancrene,1
"the 13th-century ancrene wisse,",1
"13th-century ancrene wisse, but",1
"ancrene wisse, but seems",1
"wisse, but seems to",1
but seems to have,1
seems to have become,1
to have become a,1
have become a common,1
become a common word,1
a common word in,1
common word in the,1
word in the late,1
in the late 14th,1
"the late 14th century,",1
"late 14th century, with",1
"14th century, with an",1
"century, with an early",1
with an early attestation,1
an early attestation appearing,1
early attestation appearing in,1
attestation appearing in john,1
appearing in john gower's,1
in john gower's confessio,1
john gower's confessio amantis,1
gower's confessio amantis of,1
confessio amantis of the,1
amantis of the 1390s,1
of the 1390s (vi,1
the 1390s (vi the,1
1390s (vi the task,1
(vi the task of,1
the task of historical,1
task of historical discourse,1
of historical discourse is,1
historical discourse is to,1
discourse is to identify,1
is to identify the,1
to identify the sources,1
identify the sources which,1
the sources which can,1
sources which can most,1
which can most usefully,1
can most usefully contribute,1
most usefully contribute to,1
usefully contribute to the,1
contribute to the production,1
to the production of,1
the production of accurate,1
production of accurate accounts,1
of accurate accounts of,1
accurate accounts of past,1
accounts of past some,1
of past some historians,1
past some historians strongly,1
some historians strongly support,2
historians strongly support one,2
strongly support one or,2
support one or the,2
one or the other,2
or the other classification,2
the other classification while,1
other classification while others,1
classification while others characterize,1
while others characterize history,1
others characterize history as,1
characterize history as a,1
history as a hybrid,1
as a hybrid discipline,1
a hybrid discipline that,1
hybrid discipline that does,1
discipline that does not,1
that does not belong,1
does not belong to,1
not belong to one,1
belong to one category,1
to one category at,1
one category at the,1
category at the exclusion,1
at the exclusion of,1
the exclusion of the,1
exclusion of the other,1
of the other the,1
the other the history,1
other the history of,1
the history of africa,1
history of africa stands,1
of africa stands at,1
africa stands at the,1
stands at the dawn,1
at the dawn of,1
the dawn of human,1
dawn of human history,1
of human history with,1
human history with the,1
history with the evolution,1
with the evolution of,2
the evolution of anatomically,1
evolution of anatomically modern,1
of anatomically modern humans,2
anatomically modern humans about,2
"modern humans about 200,000",1
"humans about 200,000 years",1
"about 200,000 years ago",1
"200,000 years ago the",1
years ago the former,1
ago the former is,1
the former is popular,1
former is popular among,1
is popular among the,1
popular among the older,1
among the older generation,1
the older generation and,1
older generation and is,1
generation and is most,1
and is most often,1
is most often a,1
most often a solo,1
often a solo performance,1
a solo performance of,1
solo performance of a,1
performance of a man,1
of a man plucking,1
a man plucking a,1
man plucking a cambodian,1
plucking a cambodian guitar,1
a cambodian guitar (chapei),1
cambodian guitar (chapei) in,1
guitar (chapei) in between,1
(chapei) in between a,1
in between a cappella,1
between a cappella verses,1
a cappella verses the,1
cappella verses the vietnamese-occupied,1
verses the vietnamese-occupied people's,1
the vietnamese-occupied people's republic,1
vietnamese-occupied people's republic of,1
people's republic of kampuchea,2
republic of kampuchea became,1
of kampuchea became the,1
kampuchea became the de,1
became the de facto,1
the de facto government,1
de facto government hun,1
facto government hun sen,1
government hun sen and,1
hun sen and his,1
sen and his government,1
and his government have,1
his government have seen,1
government have seen much,1
have seen much controversy,1
seen much controversy both,1
much controversy both attendance,1
controversy both attendance in,1
both attendance in person,1
attendance in person and,1
in person and viewing,1
person and viewing remotely,1
and viewing remotely can,1
viewing remotely can incur,1
remotely can incur a,1
can incur a sometimes,1
incur a sometimes substantial,1
"a sometimes substantial charge,",1
"sometimes substantial charge, such",1
"substantial charge, such as",1
"charge, such as an",1
such as an entrance,1
"as an entrance ticket,",1
"an entrance ticket, or",1
"entrance ticket, or pay-per-view",1
"ticket, or pay-per-view television",1
or pay-per-view television broadcast,1
pay-per-view television broadcast the,1
television broadcast the modern,1
broadcast the modern discipline,1
the modern discipline of,1
modern discipline of history,1
discipline of history is,1
of history is dedicated,1
history is dedicated to,1
is dedicated to the,1
dedicated to the institutional,1
to the institutional production,1
the institutional production of,1
institutional production of this,1
production of this discourse,1
of this discourse a,1
this discourse a primary,1
discourse a primary source,1
a primary source is,1
primary source is a,1
source is a source,2
is a source that,2
a source that originated,1
source that originated during,1
that originated during the,1
originated during the period,1
during the period that,1
the period that is,1
period that is studied,1
that is studied history,1
is studied history has,1
studied history has often,1
history has often been,1
has often been studied,1
often been studied with,1
been studied with some,1
studied with some practical,1
with some practical or,1
some practical or theoretical,1
"practical or theoretical aim,",1
"or theoretical aim, but",1
"theoretical aim, but may",1
"aim, but may be",1
but may be studied,1
may be studied out,1
be studied out of,1
studied out of simple,1
out of simple intellectual,1
of simple intellectual curiosity,1
simple intellectual curiosity from,1
"intellectual curiosity from 1971,",1
"curiosity from 1971, olympic",1
"from 1971, olympic athletes",1
"1971, olympic athletes were",1
olympic athletes were allowed,1
athletes were allowed to,1
were allowed to receive,1
allowed to receive compensation,1
to receive compensation and,1
"receive compensation and sponsorship,",1
"compensation and sponsorship, and",1
"and sponsorship, and from",1
"sponsorship, and from 1986,",1
"and from 1986, the",1
"from 1986, the ioc",1
"1986, the ioc decided",1
the ioc decided to,1
ioc decided to make,1
decided to make all,1
to make all professional,1
make all professional athletes,1
all professional athletes eligible,1
professional athletes eligible for,1
athletes eligible for the,1
"eligible for the olympics,",1
"for the olympics, with",1
"the olympics, with the",1
"olympics, with the exceptions",1
with the exceptions of,1
"the exceptions of boxing,",1
"exceptions of boxing, and",1
"of boxing, and wrestling",1
"boxing, and wrestling youth",1
and wrestling youth participation,1
wrestling youth participation see,1
youth participation see also:,1
participation see also: college,1
see also: college sports,1
also: college sports youth,1
college sports youth sport,1
sports youth sport presents,1
youth sport presents children,1
sport presents children with,1
presents children with opportunities,1
children with opportunities for,1
"with opportunities for fun,",1
"opportunities for fun, socialisation,",1
"for fun, socialisation, forming",1
"fun, socialisation, forming peer",1
"socialisation, forming peer relationships,",1
"forming peer relationships, physical",1
"peer relationships, physical fitness,",1
"relationships, physical fitness, and",1
"physical fitness, and athletic",1
"fitness, and athletic scholarships",1
and athletic scholarships in,1
athletic scholarships in gymnastics,1
scholarships in gymnastics or,1
in gymnastics or diving,1
gymnastics or diving the,1
or diving the result,1
diving the result is,1
the result is decided,1
result is decided by,1
is decided by a,1
decided by a panel,1
by a panel of,1
"a panel of judges,",1
"panel of judges, and",1
"of judges, and therefore",1
"judges, and therefore subjective",1
and therefore subjective certain,1
therefore subjective certain sports,1
subjective certain sports are,1
"certain sports are mixed-gender,",1
"sports are mixed-gender, allowing",1
"are mixed-gender, allowing (or",1
"mixed-gender, allowing (or even",1
allowing (or even requiring),1
(or even requiring) men,1
even requiring) men and,1
requiring) men and women,1
men and women to,1
and women to play,1
women to play on,1
to play on the,1
play on the same,1
on the same team,1
the same team in,1
"same team in 2010,",1
"team in 2010, the",1
"in 2010, the royal",1
"2010, the royal cambodian",1
the royal cambodian armed,3
royal cambodian armed forces,3
cambodian armed forces comprised,1
armed forces comprised about,1
"forces comprised about 102,000",1
"comprised about 102,000 active",1
"about 102,000 active personnel",1
"102,000 active personnel (200,000",1
"active personnel (200,000 reserve)",1
"personnel (200,000 reserve) cambodia",1
"(200,000 reserve) cambodia and",1
reserve) cambodia and china,1
cambodia and china have,1
and china have cultivated,1
china have cultivated ties,1
have cultivated ties in,1
cultivated ties in the,1
ties in the 2010ss0,1
in the 2010ss0 children,1
the 2010ss0 children gymnastics,1
2010ss0 children gymnastics appears,1
children gymnastics appears to,1
gymnastics appears to have,1
appears to have been,1
to have been popular,1
have been popular in,1
been popular in china's,1
popular in china's ancient,1
in china's ancient past,1
china's ancient past nationalism,1
ancient past nationalism is,1
past nationalism is often,1
nationalism is often evident,1
is often evident in,1
often evident in the,1
evident in the pursuit,1
in the pursuit of,1
"the pursuit of sport,",1
"pursuit of sport, or",1
"of sport, or in",1
"sport, or in its",1
or in its reporting:,1
in its reporting: people,1
its reporting: people compete,1
reporting: people compete in,1
people compete in national,1
"compete in national teams,",1
"in national teams, or",1
"national teams, or commentators",1
"teams, or commentators and",1
or commentators and audiences,1
commentators and audiences can,1
and audiences can adopt,1
audiences can adopt a,1
can adopt a partisan,1
adopt a partisan view,1
a partisan view it,1
partisan view it is,1
view it is among,1
it is among the,1
is among the most,1
among the most vulnerable,1
the most vulnerable countries,1
most vulnerable countries to,1
vulnerable countries to climate,1
countries to climate change,1
to climate change in,1
climate change in 2007,1
change in 2007 an,1
in 2007 an international,1
2007 an international team,1
an international team of,1
international team of researchers,1
team of researchers using,1
of researchers using satellite,1
researchers using satellite photographs,1
using satellite photographs and,1
satellite photographs and other,1
photographs and other modern,1
and other modern techniques,1
other modern techniques concluded,1
modern techniques concluded that,1
techniques concluded that angkor,1
concluded that angkor had,1
that angkor had been,1
angkor had been the,1
had been the largest,1
been the largest pre-industrial,1
the largest pre-industrial city,1
largest pre-industrial city in,1
pre-industrial city in the,1
city in the world,1
in the world with,1
the world with an,1
world with an urban,1
with an urban sprawl,1
an urban sprawl of,1
"urban sprawl of 2,980",1
"sprawl of 2,980 square",1
"of 2,980 square kilometres",1
"2,980 square kilometres (1,151",1
"square kilometres (1,151 square",1
"kilometres (1,151 square miles)3%",1
"(1,151 square miles)3% amnesty",1
square miles)3% amnesty international,1
miles)3% amnesty international currently,1
amnesty international currently recognises,1
international currently recognises one,1
currently recognises one prisoner,1
recognises one prisoner of,1
one prisoner of conscience,1
prisoner of conscience in,1
of conscience in the,1
conscience in the country:,1
in the country: 33-year-old,1
the country: 33-year-old land,1
country: 33-year-old land rights,1
33-year-old land rights activist,1
land rights activist yorm,1
rights activist yorm bopha,1
activist yorm bopha history,1
yorm bopha history was,1
bopha history was borrowed,1
history was borrowed from,1
was borrowed from latin,1
borrowed from latin (possibly,1
from latin (possibly via,1
latin (possibly via old,1
(possibly via old irish,1
via old irish or,1
old irish or old,1
irish or old welsh),1
or old welsh) into,1
old welsh) into old,1
welsh) into old english,1
into old english as,1
old english as stær,1
"english as stær (""history,",1
"as stær (""history, narrative,",1
"stær (""history, narrative, story""),",1
"(""history, narrative, story""), but",1
"narrative, story""), but this",1
"story""), but this word",1
but this word fell,1
this word fell out,1
word fell out of,1
fell out of use,1
out of use in,1
of use in the,1
use in the late,1
in the late old,1
the late old english,1
late old english period,1
old english period women,1
english period women in,1
period women in urban,1
women in urban areas,1
in urban areas have,1
urban areas have 2,1
areas have 2 during,1
have 2 during the,1
2 during the rule,1
during the rule of,1
the rule of jayavarman,1
rule of jayavarman viii,1
of jayavarman viii the,1
jayavarman viii the angkor,1
viii the angkor empire,1
the angkor empire was,1
angkor empire was attacked,1
empire was attacked by,1
was attacked by the,1
attacked by the mongol,1
by the mongol army,1
the mongol army of,1
mongol army of kublai,1
army of kublai khan;,1
of kublai khan; the,1
kublai khan; the king,1
khan; the king was,1
the king was able,1
king was able to,1
was able to buy,1
able to buy peace,1
to buy peace creating,1
buy peace creating a,1
"peace creating a ""level",1
"creating a ""level playing",1
"a ""level playing field""",1
"""level playing field"" for",1
"playing field"" for labour",1
"field"" for labour across",1
for labour across garment,1
labour across garment sector,1
across garment sector g,1
garment sector g missionary,1
"sector g missionary religions,",1
"g missionary religions, like",1
"missionary religions, like buddhism,",1
"religions, like buddhism, christianity,",1
"like buddhism, christianity, and",1
"buddhism, christianity, and islam,",1
"christianity, and islam, spread",1
"and islam, spread rapidly",1
"islam, spread rapidly and",1
spread rapidly and established,1
rapidly and established themselves,1
and established themselves as,1
established themselves as world,1
"themselves as world religions,",1
"as world religions, marking",1
"world religions, marking a",1
"religions, marking a cultural",1
marking a cultural shift,1
a cultural shift as,1
cultural shift as they,1
shift as they gradually,1
as they gradually replaced,1
they gradually replaced local,1
gradually replaced local belief,1
replaced local belief systems,1
local belief systems pleng,1
belief systems pleng kaah,1
systems pleng kaah (lit,1
pleng kaah (lit scholar,1
kaah (lit scholar george,1
(lit scholar george coedes,1
scholar george coedes refers,1
george coedes refers to,1
coedes refers to a,1
refers to a 10th-century,1
to a 10th-century inscription,1
a 10th-century inscription of,1
10th-century inscription of a,1
inscription of a cambodian,1
of a cambodian dynastic,1
a cambodian dynastic legend,1
cambodian dynastic legend in,1
dynastic legend in which,1
legend in which the,1
in which the hermit,1
which the hermit kambu,1
the hermit kambu swayambhuva,1
hermit kambu swayambhuva and,1
kambu swayambhuva and the,1
swayambhuva and the celestial,1
and the celestial nymph,1
the celestial nymph mera,1
celestial nymph mera unite,1
nymph mera unite and,1
mera unite and establish,1
unite and establish the,1
and establish the cambodian,1
establish the cambodian solar,1
the cambodian solar royal,1
